num,year_grade,book,chapter_num,chapter_name,section_num,section_name,knowledge_points,section_summarnum,year_grade,book,chapter_num,chapter_name,section_num,section_name,knowledge_points,section_summary
71,9,第五冊,6,社會中的勞動參與,1,為什麼勞動參與是重要的？,勞動力市場、經濟發展,本節探討了勞動參與在社會中的重要性，首先，勞動力市場是任何社會經濟的基石，勞動力的供給和需求直接影響薪資水平及工作機會，勞動參與率的高低反映了社會的經濟活力，影響著經濟增長和人口結構等因素。其次，勞動參與推動了個人和整體的經濟發展，個人因勞動獲得收入和發展機會，提升生活質量，整體上，更多的勞動參與促進創新和生產效率，增強國家的競爭力和可持續發展。這使得理解勞動參與的重要性成為每個公民必要的社會知識。
72,9,第五冊,6,社會中的勞動參與,2,為何要保障市場勞動參與？,勞動權、勞動參與保障,本節探討了市場勞動參與的重要性及保障其參與的必要性。首先，勞動權作為一項基本人權，對個體自我價值實現至關重要。擁有勞動權不僅能促進個人經濟獨立，還能提高整體社會的生產力。其次，勞動參與保障機制有助於提升就業機會，減少失業問題，並促進社會公平。這些保障措施包括完善的法律體系、公平的勞動市場及全面的教育和培訓制度，以確保不同背景和性別的人都有公平的就業機會。同時，企業和政府應合作維護勞動者的基本權益，確保在經濟發展過程中實現社會的和諧與穩定。
73,9,第六冊,1,科技發展,1,科技發展的應用與影響,科技進步、社會變革,本節探討科技發展的應用及其對社會帶來的深遠影響。首先，科技進步加速了各領域的創新與發展，例如信息技術、醫療科技及可再生能源等，都極大地改善了人們的生活質量與效率。此外，科技的應用也促進了社會結構的變革，如促進全球化進程、增強數據分析能力、改變勞動力市場形態，甚至影響到經濟模式與文化交流。其次，科技發展帶來的挑戰同樣不容忽視，諸如網絡安全問題、隱私權保護、科技倫理等，均需謹慎處理，以確保科技正向推動人類社會走向更美好的未來。因此，本節旨在使學生全盤理解科技對現代生活的深刻影響與未來趨勢。
74,9,第六冊,1,科技發展,2,尊重智慧財產權,專利權、著作權,本節主要介紹了智慧財產權的概念及其重要性。首先，智慧財產權是一種法律權利，用於保護創意及創新成果，讓創作者能夠因其勞動成果獲得合理的經濟回報，其中專利權和著作權都屬於智慧財產權的重要組成部分。其次，本節探討了專利權如何保護發明和技術，並在技術創新的過程中扮演的角色。同時，著作權則用於保護文學、藝術作品的創作，保障創作者的權益。另外，尊重智慧財產權不僅是一種法律義務，也是一種對創新價值的認同，有助於推動科技發展及社會進步。
75,9,第六冊,2,全球化的影響與挑戰,1,全球化的影響,跨國公司、文化交流,本節探討全球化對不同國家的影響，首先介紹跨國公司如何在全球經濟中扮演重要角色，影響當地經濟、就業與市場運作，並分析這種運作模式對於發展中國家和已開發國家的利弊。其次，討論全球化帶來的文化交流與融合，包括飲食、音樂、語言等方面的互動與影響。文化交流促進了多元文化的擴散與接受，然而也可能導致文化同質化的問題。此外，本節還涉及全球化如何改變人們的生活方式，以及在全球化進程中，各國為應對挑戰所採取的策略和政策。這些內容幫助學生理解全球化對社會、經濟和文化的深遠影響。
76,9,第六冊,2,全球化的影響與挑戰,2,全球化面臨的挑戰,貿易壁壘、文化衝突,全球化面臨著多方面的挑戰，其中貿易壁壘的存在使得國際間的貨物和服務流通受到限制，導致市場的非效率性和不公平競爭現象。而文化衝突則是不同國家和地區由於文化背景、價值觀念的差異，導致在全球化進程中出現的摩擦與不和諧。這些挑戰不僅影響著國際社會的和諧與穩定，也對各國的經濟和文化交流造成潛在的威脅與障礙。因此，如何在全球化的背景下促進不同國家和地區的共融，減少衝突與壁壘，成為當今國際社會的重要課題。
77,9,第六冊,3,國際參與,1,國際社會的互動,國際組織、國際合作,本節探討國際社會中的各種互動形式，特別是通過不同的國際組織和合作機制來促進各國之間的合作與交流。國際組織在全球治理中扮演著重要的角色，提供了一個多邊協商和決策的平台，使各國能夠共同解決涉及多方面的全球性問題，如環境、貿易和人權。此外，國際合作也是實現和平與安全的重要途徑，透過合作，各國可以增進相互了解、分享資源與技術，並應對共同面臨的挑戰。本節還強調了國家間互動的重要性，以及通過合作和協商來確保國際秩序和穩定的必要性。
78,9,第六冊,3,國際參與,2,我國身處的國際環境,國際合作、國際組織,本節主要介紹了我國在國際社會中的角色與參與方式。在全球化的背景下，各國之間的互動與合作被強調。我國不僅是多個國際組織的積極成員，還參與各類區域性與全球性合作倡議，如聯合國、世界貿易組織等。我國的外交政策與國際策略重點在於促進和平發展、建設和諧世界。在國際經濟、文化、科技等領域，我國的參與與貢獻日益彰顯。同時，本節還分析了國際形勢的變遷對我國政策制定的影響，強調國際合作的重要性。
