num,year_grade,book,chapter_num,chapter_name,section_num,section_name,knowledge_points,section_summarnum,year_grade,book,chapter_num,chapter_name,section_num,section_name,knowledge_points,section_summary
37,8,第三冊,5,地方政府,1,地方政府的組成,地方政府組織、權力分配,本節主要介紹地方政府的組成結構，首先探討不同層級的地方行政單位以及其組織形式，從縣、市到鄉鎮的架構與名稱差異，接著分析地方政府在地方與中央權力中的地位，並如何在法律規範下運作。討論地方自治的理念及其實際執行，其中地方政府的自主性及對民眾的影響力是焦點。還包括地方政府的職責分配，如何管理地方公共事務，並維持地方秩序。此外，闡述了地方政府的組成人員選舉機制和選舉制度，如何保障地方行政的民主與品質。整體上，本節旨在讓讀者了解地方政府的基礎功能及其在國家治理結構中的角色。
38,8,第三冊,5,地方政府,2,地方政府的職權,地方政府的組織結構、地方政府的職能,本節介紹地方政府在國家治理體系中的角色與作用，首先講述地方政府的組織結構，包括行政、立法及司法機構的配置和職能分工。這些結構和功能是保證地方政府有效運作的基礎，影響著其決策和執行能力。然後談及地方政府的具體職能，如教育、交通、治安及環境保護等方面的管理職責，並探討地方政府如何通過資源分配和政策調整，應對地方發展需求及挑戰，確保公共服務的高效提供及地區經濟社會的協調發展。同時，也提及地方政府在中央與地方關係中的權力和責任分配，強調各層級政府間的協同合作。
39,8,第三冊,6,政治參與,1,為什麼要政治參與？,公民責任、民主運作,本節討論了政治參與的重要性，強調公民在參與政治活動時所承擔的責任，這不僅有助於增強民主制度的運作效率，也提升社會的凝聚力。政治參與是公民表達意見、影響政府決策的方式之一，透過調動公眾的力量能夠監督政府行為，預防濫用職權。本節還分析了積極投票、集會遊行等行動如何能夠促進政策的制定與改進，讓不同的聲音在政治舞台上被聽見，進一步強化民眾與政府之間的互動，從而確保政府施政能契合公眾利益。
40,8,第三冊,6,政治參與,2,為什麼投票是重要的參與形式？,投票權、公民責任,本節主要探討為什麼投票是民主社會中至關重要的政治參與形式。首先，投票是人民表達意見和影響政府決策的主要途徑，能夠直接反映公民對政策、候選人和政黨的支持程度。其次，投票也是每個公民應履行的重要責任之一，體現了公民的參與精神和對於民主制度的支持。此過程不僅僅影響當前的政策方向，還在長遠上塑造國家的政治環境和社會信任。隨著社會對公民教育的重視，提升公民的政治意識和投票率已成為維持民主穩定和促進政治透明的重要手段。因此，本章節強調了投票作為政治參與形式對民主制度的不可或缺性及其對社會的深遠影響。
41,8,第三冊,6,政治參與,3,如何落實公平投票？,投票制度、選舉公平,本節內容圍繞如何確保公平投票來提升民主政治的質量。投票制度的設計直接影響到選舉的公正性，一個透明而公正的投票制度能夠增強公眾對選舉結果的信任。除了制度設計，選舉過程中的監督機制也同樣重要，這包括防止操縱選票和確保選民的自由選擇。為了維持選舉的公平性，還需提供充分的公共教育，使每個公民都能理解投票的意義和流程，並積極參與。此外，政府和社會各界還需致力於減少選舉競爭中的不當干預，確保每個候選人和政黨有平等的競爭環境。通過這些措施，我們可以確保民主制度的正常運行和社會的穩定發展。
42,8,第四冊,1,生活中的契约,1,民法典契约,合同的基本概念、合同的履行,本節探討了生活中經常遇見的契約，包括合同及其重要性。民法典中的契約涉及到了個人和企業之間的法律責任及權利保障。首先，介紹了合同的基本概念，如合同的定義、種類和作用，說明合同在雙方同意下具有法律效力。接下來，討論了合同的履行，強調誠信原則和雙方的責任，以及違約情況下的法律處理方式。學習這些知識有助於理解如何合法有效地建立和履行契約，避免不必要的法律糾紛。
43,8,第四冊,1,生活中的契约,2,如何訂立有效契約？,契約的要約與承諾、契約的法律效力,本節主要探討如何訂立一份有效的契約，首先涉及的是契約的要約與承諾，即一方提出要約並獲得另一方同意後，契約即成立。另外一個關鍵點在於契約的法律效力，包含契約必須具備的法律要素如合法目的、當事人的行為能力，以及約定條款明確等，這些要素缺一不可，以確保契約具有法律約束力。本節還強調了事先了解契約條款的重要性，防止爭議發生，以確保雙方權益得到保障。
44,8,第四冊,1,生活中的契约,3,行為能力與契約效力,行為能力、契約效力,本節探討了何謂行為能力及其對契約效力的影響。首先，行為能力關係個人能否獨立簽署契約，以達成合法交易。不同年齡及心智狀況會影響個人行為能力的認定，因此法律對不同情況的行為能力有詳細的規定。其次，契約效力則取決於當事人是否具備適當的行為能力。若一方不具備完全行為能力，則可能導致契約無效或可撤銷。這不僅保護了無行為能力或限制行為能力人，也確保契約雙方在公平的基礎上履行契約義務。了解這些概念有助於我們在生活中更有效地判斷和處理各種契約關係。
45,8,第四冊,2,民事糾紛的解決,1,民事糾紛的法律責任,法律責任的類型、歸責原則,"本節介紹民事糾紛中的法律責任，強調了解不同類型的法律責任及其對應的解決途徑是一種基本的公民素養。首先，知識點提到法律責任的類型，涵蓋了合同責任、侵權責任等，這是解決民事糾紛的核心。其次，歸責原則作為另一重要知識點，幫助理解在不同情況下，如何確定責任的範圍和方式。通過具體案例的分析，本節引導讀者在實際生活中，如何運用這些法律知識解決民事糾紛，達到維護自身合法權益的目的。總體來看，小節提供了一個完整的框架，幫助讀者全面了解民事糾紛中法律責任的各個方面。"
46,8,第四冊,2,民事糾紛的解決,2,民事糾紛的處理方式,訴訟、調解,本節主要探討民事糾紛的一些常見解決方式。首先介紹了訴訟的途徑，作為一種由法院介入且具有法律約束力的解決途徑，是許多人面臨重大糾紛時選擇的途徑之一。此外，調解作為另一種方式，則著重於雙方在第三者的協助下，自主達成和解，避免訴訟對立所帶來的時間和金錢成本。不論選擇何種方式，最終目的是維護當事人合法權益，化解矛盾並促進社會和諧。讀者將了解在日常生活中，面對不同類型的民事糾紛時，應如何選擇合適的處理方式，並權衡不同方法的利弊。
47,8,第四冊,3,刑法與刑罰,1,為什麼要制定刑法？,犯罪預防、社會秩序,本節探討刑法制定的重要性，刑法是國家用以維護社會秩序的重要法律工具之一，旨在通過懲罰違法行為來達到預防犯罪的效果。制定刑法的原因包括保護公民的生命、財產和基本權利，防止社會出現無序和混亂，並為公民提供公平的法律指導和約束。刑法也具有教育公眾的功能，提醒人們其行為界限以及違法可能帶來的後果。同時，刑法提供了一個對違法行為者進行改造和重新適應社會的機會。總體而言，制定刑法是維持國家和社會正常運行的基礎。
48,8,第四冊,3,刑法與刑罰,2,刑罰與責任能力,刑罰的目的、責任能力的概念,本節探討刑法中刑罰的意義及其目的，強調刑罰不僅是對犯罪行為的懲罰，更是一種預防犯罪及矯正犯罪者的工具。刑罰的種類和適用方式也是本節討論的重點，讓學生理解如何以法律手段維護社會秩序。此外，本節還涵蓋了責任能力的概念，這是刑法中的一個關鍵要素。責任能力關係到個人在法律上是否應對其行為承擔刑事責任，包括理解刑法條款及分析精神障礙、未成年人等特殊情況對責任能力的影響。學生需要掌握如何評估責任能力，以便在實際情境中準確判斷個人是否應承擔法律責任。
49,8,第四冊,4,刑事案件的追訴,1,犯罪的追訴過程,犯罪偵查、檢察審查,本節介紹刑事案件追訴的主要階段，包含了從犯罪偵查到檢察審查的完整過程。在犯罪偵查階段，警方會收集證據、詢問證人和嫌疑人，以確定是否有犯罪行為發生。接下來，案件轉交給檢察官進行檢察審查，他們會進一步評估證據及案件的合法性，最終決定是否提起公訴。這一過程確保了在刑事司法系統中，所有案件都經過嚴謹的調查和公正的審查，以保護嫌疑人和被害人的權益。整個追訴過程強調準確和公平，以維護法律的公正性和完整性。
50,8,第四冊,4,刑事案件的追訴,2,警察、檢察官及法官的職權,案件調查、法律審判,這一節主要介紹了警察、檢察官及法官在刑事案件追訴過程中的各自職權。首先，警察負責刑事案件的初步調查和證據收集，是整個司法程序的第一環節，其目的是確保犯罪嫌疑人的行為得到有效地證據支持。其次，檢察官是案件的主控一方，他們負責對案件進行進一步的審查和控訴，以及決定是否起訴犯罪嫌疑人。他們在司法程序中的角色至關重要，因為他們需要確保所有的證據都足以支持對嫌疑人的控訴，並且要對法律適用準確無誤。最後，法官是案件的最終裁決者，負責審查檢察官和辯護方提交的證據，確保審判過程的公平公正，並根據法律作出決定和判刑。他們的判決直接決定了嫌疑人的命運，因此職責重大。這些法律角色分工明確，但需緊密合作，以維護司法公正。
51,8,第四冊,5,行政法規與行政救濟,1,行政法規與依法行政,依法行政、法律保留,行政法規與依法行政是現代法治國家的基本原則和核心內容之一。在此章節中，我們探討了行政法規的意義和作用，強調行政機關在行使權力時必須依據法律行事，不能超越法律的授權範圍，避免濫用行政權。此外，法律保留原則要求任何對公民權利與義務的影響，都必須有法律明確依據，這不僅是對行政活動的規制，也是對公民權利的保障。本章節還介紹了行政法規的制定和運作過程，旨在確保行政行為的合法性和合理性，以維護公共利益和法律秩序。
52,8,第四冊,5,行政法規與行政救濟,2,生活中有哪些常見的行政管理？,行政行為、行政程序,本節介紹了生活中常見的行政管理，包括政府如何通過制定和執行各種規範和政策，以維持公共秩序和促進社會福利。行政行為被視為政府機構為實現公共利益而採取的具體措施或行動，其中可能包含各類官方決策，如財政預算的分配或重大基礎設施的規劃。行政程序則指揮有關部門如何進行具體的行政行為，其目的在於確保這些行為符合法律程序，保障公民的權益和參與權。對於普通公民而言，理解和利用行政程序，可以有效地維護自身合法權益，保障在遭遇行政行為時能夠合理應對。
53,8,第四冊,5,行政法規與行政救濟,3,行政救濟的方法,訴願制度、行政訴訟制度,本節介紹行政救濟的方法，主要著重於探討在行政行為下對不當或違法決策的救濟管道。首先，訴願制度是行政救濟的第一道程序，旨在讓人民對於行政機關所作的不當決策提出異議，這提供一個更迅速且低成本的解決方案。其次，若訴願不成或對結果仍不滿意，人民可進而提起行政訴訟制度，此途徑為司法救濟的方式，由法院作出最終的裁判。此外，小節中也分析了兩種制度的優劣與適用範圍，探討如何在不同的情況下選擇適當的救濟方式，以確保公民權益得到有效保障，並保持行政機關的依法行政。整體而言，行政救濟方法的設計，旨在提供全面的權利保護途徑，以促進行政透明度和法治。
54,8,第四冊,6,兒少權益的維護,1,兒少權益誰來維護？,兒少福利發展法、兒童權利公約,本節探討兒童及少年權益的維護，強調社會對弱勢族群的保護責任。首先介紹《兒少福利發展法》，這是確保兒少基本權益的重要法律，規範政府及相關機構應提供的保護措施。此外，本節還提及《兒童權利公約》，該公約對兒童的生存、保護、發展及參與權提出國際性認可標準，各國需致力實行以保障兒少健全成長。本節強調政府與社會的共同責任，並呼籲大家加強對兒少權益問題的關注與行動，以確保兒童及少年健康成長環境的持續改善。
55,8,第四冊,6,兒少權益的維護,2,少年犯罪行為的處理,少年犯矯正機構、再犯預防措施,本節討論了少年犯罪行為的處理，重點在於如何有效地矯正和預防青少年再犯。首先，政府和社會組織需要協同合作，為少年犯提供專門的矯正機構，這些機構不僅注重法律制裁，更強調心理疏導和教育，以改變其行為模式。其次，預防再犯是處理少年犯罪中不可或缺的一環，透過早期介入、持續跟蹤輔導以及提供職業訓練和教育機會，使青少年重新融入社會，避免再次走上犯罪道路。綜合考量每名少年犯的背景和需求，量身訂製的矯正方案是成功的關鍵。
56,9,第五冊,1,選擇與消費,1,選擇與機會成本,選擇、機會成本,本節介紹選擇與消費決策中重要的概念，如選擇與機會成本。選擇是指個人在資源有限的情況下，為了達成目標需做出的多種決策。這些選擇背後隱含著機會成本的考量，即放棄某一選項所失去的潛在收益。選擇通常受限於收入、價格和個人偏好，對生活決策有深遠影響。因此，了解選擇與機會成本可幫助個人做出更佳決策。本節強調合理資源分配對提高個人滿意度和生活品質的重要性，並提供一些評估選擇的方法以優化消費決策。
57,9,第五冊,1,選擇與消費,2,誘因影響選擇行為,誘因的重要性、消費選擇的影響,本節內容探討了誘因在影響消費者選擇行為中的關鍵作用。首先，誘因的重要性是每個消費者在做出購買決策時考量的核心因素之一。消費選擇的影響體現在各種誘惑性優惠或者促銷戰略中，消費刺激如折扣、贈品和會員積分計畫等，都是強而有力的誘因策略，能夠驅使消費者做出特定的購買決策。在了解這些誘因之後，企業可以更有效地設計行銷計畫，從而達到影響消費者選擇行為的最終目的。此外，消費者也應該意識到這些誘因的存在，從而在做出選擇時更加理性和客觀。
58,9,第五冊,1,選擇與消費,3,影響消費者的因素,文化和價值觀、社會經濟地位,本節介紹影響消費者的多種因素，文化和價值觀是關鍵的一環，因為它們塑造了人們的偏好和消費習慣，不同文化背景下的消費行為可能有顯著差異。此外，社會經濟地位同樣對消費選擇有重要影響，消費者的收入水平、職業和教育程度等均會影響其購物行為和消費決策。具體而言，收入較高的群體往往具有較高的購買力，能夠選擇質量更高的商品和服務，而收入較低的群體則可能更加關注性價比。在全球化和互聯網時代，這些因素的影響變得更加顯著和多樣化，因此理解這些因素的相互作用對於商家來說至關重要，能夠幫助他們更好地鎖定目標市場並制定合適的行銷策略。
59,9,第五冊,2,生產與資源分配,1,生產與利潤,生產因素、利潤最大化,在生產與利潤的討論中，首先介紹了生產過程的基本組成，包括土地、勞動、資本與企業家才能等生產要素的組合及其效率。其中，生產因素的有效利用是企業競爭力提升的關鍵。另外，文中著重講述企業在生產過程中追求利潤最大化的策略，這涉及到產品定價、成本控制及市場需求分析。通過對成本收益分析方法的探討，了解如何在不斷變化的市場環境中做出適應性決策，以實現企業的長期可持續發展和競爭優勢。整體來看，該小節強調了理論與實際應用相結合的重要性。
60,9,第五冊,2,生產與資源分配,2,影響生產者的因素,資源稟賦、生產成本,本節主要探討影響生產者決策的各種因素，包括自然資源、技術水平和市場需求等。首先，資源稟賦是決定生產者能夠利用哪些資源進行生產的重要因素，這會直接影響生產效率和產品的質量。此外，生產成本也是生產者須考量的關鍵因素，成本的高低會影響最終產品的定價和市場競爭力。生產者在制定生產計劃時，必須權衡這些因素，以達到最大化效率和收益的目標。通過了解和分析這些影響因素，生產者可以更有效地做出生產決策，提高生產力和競爭力。
61,9,第五冊,2,生產與資源分配,3,資源分配與公平正義,資源分配、公平正義,本節探討資源分配的原則和實踐，強調在有限資源下如何有效和公正地進行分配。資源分配涉及到經濟體系中資源的配置，考慮效率與效率之間的平衡以及分配的公平性。公平正義是另一個核心議題，討論如何在資源分配中維護社會公正，減少貧富差距，並確保每個人都有基本生活保障。通過案例分析，本節闡述了不同分配模式對社會結構和個人生活的影響，強調了決策者在政策制定中兼顧效率與公平的必要性，並指出社會資源分配不僅是經濟問題，也是深刻的社會倫理挑戰。
62,9,第五冊,3,市場與競爭,1,市場與交易,供給與需求理論、市場均衡,本節介紹市場與交易的基本概念，首先闡述了供給與需求理論，這是市場如何運作的核心原理。當需求增加而供給不變時，價格會上升，反之亦然，這動態影響著市場價格和交易量。繼而討論市場均衡，指出在均衡狀態下，市場供需一致，沒有短缺或盈餘。理解這些概念有助於分析市場反應及預測價格變動，並強調市場調節機制在資源分配中的角色。此外，市場與交易的過程不僅涉及經濟計算，還牽涉心理與社會因素，影響決策行為和交易效率。
63,9,第五冊,3,市場與競爭,2,市場競爭方式與程度,供需法則、完全競爭市場,本節主要介紹市場競爭的不同方式與程度，分析市場如何運作的機制。首先討論供需法則，說明市場價格如何通過需求與供給的相互作用而決定，並進一步探討價格如何影響市場資源的配置。接著講解完全競爭市場的概念，此類市場中有許多買賣雙方，產品同質且透明度高，參與者不具有影響價格的能力，因此價格只能由市場決定，進而達到資源最有效的分配。了解以上概念有助於學生對市場運作的基本原理和不同競爭程度下的市場行為有更深入的認識。
64,9,第五冊,3,市場與競爭,3,消費者權益的保障,消費者權益、保障措施,本節主要探討消費者在市場競爭環境中所擁有的各項權益及其保障措施。首先，消費者權益指的是消費者作為市場的重要一環，應享有的知情權、安全權、公平交易權等基本權益。為保障這些權益，各國政府通常設立相關法律法規，如《消費者保護法》，以確保消費者在商品或服務選擇過程中的安全和公平。此外，消費者個人應具備一定的維權意識和能力，善於利用法律途徑、消費者委員會等機制，積極維護自身利益。本節強調了解和行使消費者權益的重要性，以及社會各界共同努力以提升消費者保障水平的必要性。
65,9,第五冊,4,分工與貿易,1,分工合作的社會,分工、合作,本節介紹了分工在社會中的重要性以及合作的必要性。透過分工，各個個體能夠專注於自己擅長的領域，提高整體效率，進而促進生產力的提升。分工讓社會中的專業技能得以深入發展，同時也導致經濟的互賴性增加。因此，協作成為保障社會高效運行的關鍵。另外，隨著全球化的發展，國家之間的分工和貿易日益密切。一國的勞動者和企業通過分工與合作，不僅能夠有效地生產產品，還能夠進行貿易以獲取更多的資源和利益。因此，理解分工合作的原理對於認識現代經濟和社會運作具有重要意義。
66,9,第五冊,4,分工與貿易,2,國際分工與國際貿易,絕對利益法則、比較利益法則,本節主要探討國際分工與貿易的基本概念，強調各國透過分工提升生產效率的優勢。首先介紹絕對利益法則，指出當一國在某產品的生產上具有絕對優勢時，該國應專注生產此產品並出口以獲取最大利益。接著解釋比較利益法則，即使一國在所有產品的生產上都不具絕對優勢，仍然可以透過專注於相對效率較高的產品進行貿易，從而提高全球資源的配置效率。這兩個法則示範了為何國際貿易能促進經濟成長，並引導各國在經濟全球化中如何運用分工實現雙贏。
67,9,第五冊,4,分工與貿易,3,臺灣開放進口商品的利弊,開放進口、平衡發展,在這一節中，我們探討了臺灣開放進口商品所帶來的利與弊。開放進口有助於提升市場競爭力，促進臺灣經濟的國際化與多樣化，有利於消費者獲取更多選擇和更低的價格。然而，過度依賴進口產品也可能導致本地產業的衰退，影響經濟自主性，進而可能造成就業市場的不穩定。因此，如何在促進進口和保護本地產業之間找到平衡成為政策制定者面臨的挑戰。政策需要兼顧國際市場的需求和本地經濟的穩定發展，以實現經濟的可持續性和平衡增長。
68,9,第五冊,5,貨幣的使用,1,為什麼會出現貨幣？,交易的需求、價值儲藏,本節主要探討了貨幣的起源及其必要性。最初，人們通過以物易物的方式進行交易，但隨著經濟活動的增強和需求的複雜化，以物易物所涉及的交換困難逐漸顯現，特別是在匹配雙方需求時的低效率問題。於是，一種穩定且普遍接受的交換媒介——貨幣便自然誕生，以解決交易中的不便。貨幣不僅充當交易的中介，更重要的是它具備價值儲藏功能，能夠有效地保存並累積財富，從而促進了市場經濟的深化和跨時間的資源配置。
69,9,第五冊,5,貨幣的使用,2,新型態的支付工具,電子支付、數字貨幣,隨著科技的進步，新型態的支付工具逐漸取代傳統的現金支付。其中，電子支付以其便捷性和安全性成為消費者的首選，涵蓋了行動支付、雲端支付等多種形式。數字貨幣則是由中央銀行或私人機構發行的虛擬貨幣，它不僅可以降低交易成本，還可以提升支付效率。這些工具的普及正在改變人們的支付習慣，推動著經濟活動的數字化。在這樣的背景下，了解並適應這些新型支付工具變得越發重要，既能掌握消費趨勢，也為財務管理提供了便利。
70,9,第五冊,5,貨幣的使用,3,外幣與匯率,匯率、外匯市場,本節探討了外幣的概念及其在國際貿易和金融中的角色。匯率作為不同國家貨幣間的交換比例，對國際經濟活動有重大影響。外匯市場是世界上最具流動性和規模龐大的市場，作用於國際匯率的形成及調整。此章節解析了匯率的決定因素，包括供求關係、中央銀行政策、經濟指標和市場情緒等。還探討了固定匯率與浮動匯率制度的優缺點，及其對一國經濟的影響。此外，小節也涵蓋了匯率變動如何影響進出口、跨國投資及旅行消費等方面，深入淺出地解釋了匯率變動的經濟和社會效應。
